{
  "version": 2,
  "profile": "local-session-event-search-v2",
  "historyVersion": 2,
  "contentPolicy": "public-v1",
  "allowedSessions": "current-task",
  "boundary": "pre-step",
  "capabilities": [
    "session_event_read",
    "session_event_search"
  ],
  "maxInputBytes": 2048,
  "maxJsonDepth": 4,
  "maxWindowSide": 4,
  "maxNeighbors": 8,
  "maxEventBytes": 16384,
  "maxEvents": 128,
  "maxSummaryCodePoints": 256,
  "maxSummaryTextBytes": 1024,
  "maxSummaryJsonBytes": 1536,
  "maxOutputBytes": 32768,
  "maxReadRows": 9,
  "maxReadScratchBytes": 1048576,
  "maxContextBytes": 4096,
  "maxRecent": 8,
  "timeoutMs": 2000,
  "lockWaitSeconds": 1,
  "maxModelRequestBytes": 65536,
  "maxCheckpointBytes": 131072,
  "maxModelResponseBytes": 16384,
  "maxCallsPerResponse": 4,
  "maxModelRequests": 8,
  "maxToolInvocations": 20,
  "maxAttempts": 8,
  "maxReliableEvents": 256,
  "maxSummaryBytes": 8192,
  "maxDatabaseBodyBytes": 7340032,
  "maxMetadataBytes": 65536,
  "reservedTaskBytes": 8388608,
  "retentionSeconds": 604800,
  "catalogDigest": "3b46a1165221462186eb862d4c86ed6e9f7258b0a05abfe03d5e35896db1a3dd",
  "eventVersion": 2,
  "maxReadInputBytes": 1024,
  "maxNormalizedQueryBytes": 2048,
  "maxQueryCodePoints": 256,
  "maxQueryBytes": 1024,
  "matchPolicy": "public-content-literal-v1",
  "ordering": "occurrences-desc,length-asc,time-desc,seq-desc",
  "maxSearchRows": 128,
  "maxSearchEventBytes": 2097152,
  "maxSearchReadBytes": 8388608,
  "maxSearchScratchBytes": 8388608,
  "maxSearchSourceReads": 1024,
  "maxSearchComparisons": 8388608,
  "maxSearchResults": 16,
  "maxSnippetCodePoints": 240,
  "maxSnippetTextBytes": 960,
  "maxSnippetJsonBytes": 1536,
  "maxSearchHitBytes": 2048
}
